21:59:58.270668 IP (tos 0x0, ttl 54, id 14005, offset 0, flags [DF], proto UDP (17), length 1116)
    pool-209-157-pppoe.icn.od.ua.27140 > 192.168.3.100.14874: [udp sum ok] UDP, length 1088
21:59:58.271127 IP (tos 0x0, ttl 54, id 14006, offset 0, flags [DF], proto UDP (17), length 1116)
    pool-209-157-pppoe.icn.od.ua.27140 > 192.168.3.100.14874: [udp sum ok] UDP, length 1088
21:59:58.271647 IP (tos 0x0, ttl 54, id 14007, offset 0, flags [DF], proto UDP (17), length 1116)
    pool-209-157-pppoe.icn.od.ua.27140 > 192.168.3.100.14874: [udp sum ok] UDP, length 1088
21:59:58.349167 IP (tos 0x0, ttl 64, id 20238, offset 0, flags [DF], proto TCP (6), length 1108)
    192.168.3.100.46438 > singapore.test.11372: Flags [P.], cksum 0xd1a0 (incorrect -> 0x7356), seq 4021369258:4021370314, ack 3721723193, win 134, options [nop,nop,TS val 26203289 ecr 422002496], length 1056
21:59:58.358437 IP (tos 0x0, ttl 64, id 0, offset 0, flags [DF], proto UDP (17), length 146)
    192.168.3.100.14874 > pool-209-157-pppoe.icn.od.ua.27140: [bad udp cksum 0xc45e -> 0x8fd8!] UDP, length 118
21:59:58.451811 IP (tos 0x0, ttl 64, id 0, offset 0, flags [DF], proto UDP (17), length 99)
    192.168.3.100.3333 > 255.255.255.255.3333: [bad udp cksum 0xc46c -> 0x6ae8!] UDP, length 71
21:59:58.597147 IP (tos 0x0, ttl 113, id 25208, offset 0, flags [DF], proto TCP (6), length 52)
    cpe-98-146-128-80.natnow.res.rr.com.51032 > 192.168.3.100.15441: Flags [.], cksum 0x187d (correct), seq 2893397839, ack 1355663336, win 259, options [nop,nop,sack 1 {4294967230:1}], length 0
21:59:58.597724 IP (tos 0x0, ttl 64, id 57814, offset 0, flags [none], proto UDP (17), length 83)
    192.168.3.100.33333 > 46.47.254.2.domain: [bad udp cksum 0xf08e -> 0x4d14!] 50677+ [1au] PTR? 80.128.146.98.in-addr.arpa. ar: . OPT UDPsize=4096 DO (55)
21:59:58.630646 IP (tos 0x0, ttl 56, id 14654, offset 0, flags [DF], proto TCP (6), length 52)
    singapore.test.11372 > 192.168.3.100.46438: Flags [.], cksum 0x842d (correct), seq 1, ack 1056, win 2903, options [nop,nop,TS val 422002737 ecr 26203289], length 0
21:59:58.630677 IP (tos 0x0, ttl 64, id 20239, offset 0, flags [DF], proto TCP (6), length 1108)
    192.168.3.100.46438 > singapore.test.11372: Flags [P.], cksum 0xd1a0 (incorrect -> 0x98d7), seq 1056:2112, ack 1, win 134, options [nop,nop,TS val 26203360 ecr 422002737], length 1056
21:59:58.663920 IP (tos 0x0, ttl 53, id 42974, offset 0, flags [DF], proto TCP (6), length 595)
    82.ip-51-254-120.eu.https > 192.168.3.100.50430: Flags [P.], cksum 0xc2f7 (correct), seq 2530533056:2530533599, ack 2607002977, win 1804, options [nop,nop,TS val 132926460 ecr 26203223], length 543
21:59:58.664818 IP (tos 0x0, ttl 64, id 23446, offset 0, flags [DF], proto TCP (6), length 595)
    192.168.3.100.50430 > 82.ip-51-254-120.eu.https: Flags [P.], cksum 0x72a2 (incorrect -> 0xe55a), seq 1:544, ack 543, win 331, options [nop,nop,TS val 26203368 ecr 132926460], length 543
21:59:58.692651 IP (tos 0x0, ttl 53, id 42975, offset 0, flags [DF], proto TCP (6), length 52)
    82.ip-51-254-120.eu.https > 192.168.3.100.50430: Flags [.], cksum 0x439b (correct), seq 543, ack 544, win 1804, options [nop,nop,TS val 132926467 ecr 26203368], length 0
21:59:58.893169 IP (tos 0x0, ttl 54, id 0, offset 0, flags [DF], proto TCP (6), length 356)
    host109-145-119-56.range109-145.btcentralplus.com.33610 > 192.168.3.100.41373: Flags [P.], cksum 0x3cd2 (correct), seq 1653110386:1653110690, ack 2431890301, win 4119, options [nop,nop,TS val 802199495 ecr 26203405], length 304
21:59:58.893202 IP (tos 0x0, ttl 64, id 26463, offset 0, flags [DF], proto TCP (6), length 52)
    192.168.3.100.41373 > host109-145-119-56.range109-145.btcentralplus.com.33610: Flags [.], cksum 0xa8fc (incorrect -> 0xeb9f), seq 1, ack 304, win 123, options [nop,nop,TS val 26203425 ecr 802199495], length 0
21:59:58.893794 IP (tos 0x0, ttl 64, id 57815, offset 0, flags [none], proto UDP (17), length 84)
    192.168.3.100.33333 > 46.47.254.2.domain: [bad udp cksum 0xf08f -> 0x200f!] 7331+ [1au] PTR? 56.119.145.109.in-addr.arpa. ar: . OPT UDPsize=4096 DO (56)
21:59:58.911611 IP (tos 0x0, ttl 64, id 26464, offset 0, flags [DF], proto TCP (6), length 516)
    192.168.3.100.41373 > host109-145-119-56.range109-145.btcentralplus.com.33610: Flags [P.], cksum 0xaacc (incorrect -> 0x556c), seq 1:465, ack 304, win 123, options [nop,nop,TS val 26203430 ecr 802199495], length 464
21:59:58.911660 IP (tos 0x0, ttl 56, id 14655, offset 0, flags [DF], proto TCP (6), length 52)
    singapore.test.11372 > 192.168.3.100.46438: Flags [.], cksum 0x7f80 (correct), seq 1, ack 2112, win 2903, options [nop,nop,TS val 422002807 ecr 26203360], length 0
21:59:58.955908 IP (tos 0x0, ttl 54, id 0, offset 0, flags [DF], proto TCP (6), length 52)
    host109-145-119-56.range109-145.btcentralplus.com.33610 > 192.168.3.100.41373: Flags [.], cksum 0xda09 (correct), seq 304, ack 465, win 4105, options [nop,nop,TS val 802199546 ecr 26203430], length 0
21:59:58.957900 IP (tos 0x0, ttl 54, id 0, offset 0, flags [DF], proto TCP (6), length 116)
    host109-145-119-56.range109-145.btcentralplus.com.33610 > 192.168.3.100.41373: Flags [P.], cksum 0x0eea (correct), seq 304:368, ack 465, win 4105, options [nop,nop,TS val 802199547 ecr 26203430], length 64
21:59:59.272948 IP (tos 0x0, ttl 53, id 42976, offset 0, flags [DF], proto TCP (6), length 595)
    82.ip-51-254-120.eu.https > 192.168.3.100.50430: Flags [P.], cksum 0x1f1c (correct), seq 543:1086, ack 544, win 1804, options [nop,nop,TS val 132926612 ecr 26203368], length 543
21:59:59.274299 IP (tos 0x0, ttl 64, id 23447, offset 0, flags [DF], proto TCP (6), length 2932)
    192.168.3.100.50430 > 82.ip-51-254-120.eu.https: Flags [.], cksum 0x7bc3 (incorrect -> 0x4237), seq 544:3424, ack 1086, win 331, options [nop,nop,TS val 26203521 ecr 132926612], length 2880
21:59:59.274317 IP (tos 0x0, ttl 64, id 23449, offset 0, flags [DF], proto TCP (6), length 1253)
    192.168.3.100.50430 > 82.ip-51-254-120.eu.https: Flags [P.], cksum 0x7534 (incorrect -> 0x9bc5), seq 3424:4625, ack 1086, win 331, options [nop,nop,TS val 26203521 ecr 132926612], length 1201
21:59:59.274348 IP (tos 0x0, ttl 64, id 23450, offset 0, flags [DF], proto TCP (6), length 1492)
    192.168.3.100.50430 > 82.ip-51-254-120.eu.https: Flags [.], cksum 0x7623 (incorrect -> 0x4379), seq 4625:6065, ack 1086, win 331, options [nop,nop,TS val 26203521 ecr 132926612], length 1440
21:59:59.303176 IP (tos 0x0, ttl 53, id 42977, offset 0, flags [DF], proto TCP (6), length 52)
    82.ip-51-254-120.eu.https > 192.168.3.100.50430: Flags [.], cksum 0x3aaa (correct), seq 1086, ack 1984, win 1804, options [nop,nop,TS val 132926620 ecr 26203521], length 0
21:59:59.304135 IP (tos 0x0, ttl 53, id 42978, offset 0, flags [DF], proto TCP (6), length 52)
    82.ip-51-254-120.eu.https > 192.168.3.100.50430: Flags [.], cksum 0x350a (correct), seq 1086, ack 3424, win 1804, options [nop,nop,TS val 132926620 ecr 26203521], length 0
21:59:59.305643 IP (tos 0x0, ttl 53, id 42979, offset 0, flags [DF], proto TCP (6), length 52)
    82.ip-51-254-120.eu.https > 192.168.3.100.50430: Flags [.], cksum 0x3058 (correct), seq 1086, ack 4625, win 1804, options [nop,nop,TS val 132926621 ecr 26203521], length 0
21:59:59.305672 IP (tos 0x0, ttl 64, id 23451, offset 0, flags [DF], proto TCP (6), length 1271)
    192.168.3.100.50430 > 82.ip-51-254-120.eu.https: Flags [P.], cksum 0x7546 (incorrect -> 0x4d6b), seq 6065:7284, ack 1086, win 331, options [nop,nop,TS val 26203528 ecr 132926621], length 1219
21:59:59.306385 IP (tos 0x0, ttl 53, id 42980, offset 0, flags [DF], proto TCP (6), length 52)
    82.ip-51-254-120.eu.https > 192.168.3.100.50430: Flags [.], cksum 0x2ab8 (correct), seq 1086, ack 6065, win 1804, options [nop,nop,TS val 132926621 ecr 26203521], length 0
21:59:59.334424 IP (tos 0x0, ttl 53, id 42981, offset 0, flags [DF], proto TCP (6), length 52)
    82.ip-51-254-120.eu.https > 192.168.3.100.50430: Flags [.], cksum 0x25e7 (correct), seq 1086, ack 7284, win 1804, options [nop,nop,TS val 132926628 ecr 26203528], length 0
21:59:59.452184 IP (tos 0x0, ttl 64, id 0, offset 0, flags [DF], proto UDP (17), length 99)
    192.168.3.100.3333 > 255.255.255.255.3333: [bad udp cksum 0xc46c -> 0x6ae8!] UDP, length 71
21:59:59.564028 IP6 (hlim 255, next-header UDP (17) payload length: 60) p200300E853D8E07A1E7508FFFEA2DFF0.dip0.t-ipconnect.de.14874 > 2a01:4f8:c17:b9::2.9915: [udp sum ok] UDP, length 52
21:59:59.564851 IP (tos 0x0, ttl 64, id 57816, offset 0, flags [none], proto UDP (17), length 129)
    192.168.3.100.33333 > 46.47.254.2.domain: [bad udp cksum 0xf0bc -> 0x3c01!] 45931+ [1au] PTR? 2.0.0.0.0.0.0.0.0.0.0.0.0.0.0.0.9.b.0.0.7.1.c.0.8.f.4.0.1.0.a.2.ip6.arpa. ar: . OPT UDPsize=4096 DO (101)
21:59:59.564930 IP (tos 0x0, ttl 64, id 57817, offset 0, flags [none], proto UDP (17), length 56)
    192.168.3.100.33333 > 46.47.254.2.domain: [bad udp cksum 0xf073 -> 0x4140!] 46993+ [1au] NS? . ar: . OPT UDPsize=4096 DO (28)
21:59:59.633963 IP (tos 0x0, ttl 55, id 0, offset 0, flags [DF], proto UDP (17), length 267)
    46.47.254.2.domain > 192.168.3.100.33333: [udp sum ok] 46993 q: NS? . 13/0/1 . NS e.root-servers.net., . NS i.root-servers.net., . NS b.root-servers.net., . NS l.root-servers.net., . NS g.root-servers.net., . NS k.root-servers.net., . NS h.root-servers.net., . NS a.root-servers.net., . NS m.root-servers.net., . NS f.root-servers.net., . NS j.root-servers.net., . NS c.root-servers.net., . NS d.root-servers.net. ar: . OPT UDPsize=1280 DO (239)
21:59:59.706448 IP (tos 0x0, ttl 55, id 0, offset 0, flags [DF], proto UDP (17), length 194)
    46.47.254.2.domain > 192.168.3.100.33333: [udp sum ok] 45931 NXDomain q: PTR? 2.0.0.0.0.0.0.0.0.0.0.0.0.0.0.0.9.b.0.0.7.1.c.0.8.f.4.0.1.0.a.2.ip6.arpa. 0/1/1 ns: 8.f.4.0.1.0.a.2.ip6.arpa. SOA ns1.your-server.de. postmaster.your-server.de. 2017124036 86400 1800 3600000 86400 ar: . OPT UDPsize=1280 DO (166)
21:59:59.825230 IP (tos 0x0, ttl 54, id 15637, offset 0, flags [DF], proto UDP (17), length 1116)
    ip-176-195-174-253.bb.netbynet.ru.23654 > 192.168.3.100.14874: [udp sum ok] UDP, length 1088
21:59:59.826052 IP (tos 0x0, ttl 64, id 26468, offset 0, flags [DF], proto TCP (6), length 1108)
    192.168.3.100.41373 > host109-145-119-56.range109-145.btcentralplus.com.33610: Flags [P.], cksum 0xad1c (incorrect -> 0x053b), seq 3937:4993, ack 1104, win 134, options [nop,nop,TS val 26203659 ecr 802199622], length 1056
21:59:59.826419 IP (tos 0x0, ttl 64, id 57818, offset 0, flags [none], proto UDP (17), length 85)
    192.168.3.100.33333 > 46.47.254.2.domain: [bad udp cksum 0xf090 -> 0xa7ec!] 48480+ [1au] PTR? 253.174.195.176.in-addr.arpa. ar: . OPT UDPsize=4096 DO (57)
21:59:59.871185 IP (tos 0x0, ttl 54, id 0, offset 0, flags [DF], proto TCP (6), length 52)
    host109-145-119-56.range109-145.btcentralplus.com.33610 > 192.168.3.100.41373: Flags [.], cksum 0xc17a (correct), seq 1104, ack 4993, win 4063, options [nop,nop,TS val 802200318 ecr 26203659], length 0
21:59:59.896599 IP (tos 0x0, ttl 64, id 1516, offset 0, flags [DF], proto TCP (6), length 1108)
    192.168.3.100.39135 > broadband-109-173-110-92.moscow.rt.ru.26446: Flags [P.], cksum 0xa45c (incorrect -> 0x2a1d), seq 232775673:232776729, ack 1446363627, win 135, options [nop,nop,TS val 26203676 ecr 1075747594], length 1056
21:59:59.922985 IP (tos 0x0, ttl 55, id 0, offset 0, flags [DF], proto UDP (17), length 132)
    46.47.254.2.domain > 192.168.3.100.33333: [udp sum ok] 48480 q: PTR? 253.174.195.176.in-addr.arpa. 1/0/1 253.174.195.176.in-addr.arpa. PTR ip-176-195-174-253.bb.netbynet.ru. ar: . OPT UDPsize=1280 DO (104)
21:59:59.971937 IP (tos 0x0, ttl 64, id 1517, offset 0, flags [DF], proto TCP (6), length 1492)
    192.168.3.100.39135 > broadband-109-173-110-92.moscow.rt.ru.26446: Flags [.], cksum 0xa5dc (incorrect -> 0xad49), seq 1056:2496, ack 1, win 135, options [nop,nop,TS val 26203695 ecr 1075747594], length 1440
21:59:59.973271 IP (tos 0x0, ttl 53, id 47088, offset 0, flags [DF], proto TCP (6), length 52)
    broadband-109-173-110-92.moscow.rt.ru.26446 > 192.168.3.100.39135: Flags [.], cksum 0xe181 (correct), seq 1, ack 1056, win 654, options [nop,nop,TS val 1075761285 ecr 26203676], length 0
21:59:59.973307 IP (tos 0x0, ttl 64, id 1518, offset 0, flags [DF], proto TCP (6), length 724)
    192.168.3.100.39135 > broadband-109-173-110-92.moscow.rt.ru.26446: Flags [P.], cksum 0xa2dc (incorrect -> 0xc1e9), seq 2496:3168, ack 1, win 135, options [nop,nop,TS val 26203695 ecr 1075761285], length 672
22:00:00.020229 IP (tos 0x0, ttl 53, id 42982, offset 0, flags [DF], proto TCP (6), length 595)
    82.ip-51-254-120.eu.https > 192.168.3.100.50430: Flags [P.], cksum 0xfa5c (correct), seq 1086:1629, ack 7284, win 1804, options [nop,nop,TS val 132926799 ecr 26203528], length 543
22:00:00.025056 IP (tos 0x0, ttl 64, id 23452, offset 0, flags [DF], proto TCP (6), length 595)
    192.168.3.100.50430 > 82.ip-51-254-120.eu.https: Flags [P.], cksum 0x72a2 (incorrect -> 0x9724), seq 7284:7827, ack 1629, win 331, options [nop,nop,TS val 26203708 ecr 132926799], length 543
22:00:00.047199 IP (tos 0x0, ttl 53, id 47089, offset 0, flags [DF], proto TCP (6), length 52)
    broadband-109-173-110-92.moscow.rt.ru.26446 > 192.168.3.100.39135: Flags [.], cksum 0xdb57 (correct), seq 1, ack 2496, win 699, options [nop,nop,TS val 1075761359 ecr 26203695], length 0
22:00:00.047657 IP (tos 0x0, ttl 53, id 47090, offset 0, flags [DF], proto TCP (6), length 52)
    broadband-109-173-110-92.moscow.rt.ru.26446 > 192.168.3.100.39135: Flags [.], cksum 0xd889 (correct), seq 1, ack 3168, win 744, options [nop,nop,TS val 1075761360 ecr 26203695], length 0
22:00:00.052696 IP (tos 0x0, ttl 53, id 42983, offset 0, flags [DF], proto TCP (6), length 52)
    82.ip-51-254-120.eu.https > 192.168.3.100.50430: Flags [.], cksum 0x2042 (correct), seq 1629, ack 7827, win 1804, options [nop,nop,TS val 132926807 ecr 26203708], length 0
22:00:00.090094 IP (tos 0x0, ttl 64, id 0, offset 0, flags [DF], proto UDP (17), length 105)
    192.168.3.100.14874 > ip-176-195-174-253.bb.netbynet.ru.23654: [bad udp cksum 0x2434 -> 0x90cb!] UDP, length 77
22:00:00.109753 IP (tos 0x0, ttl 54, id 15649, offset 0, flags [DF], proto UDP (17), length 1116)
    ip-176-195-174-253.bb.netbynet.ru.23654 > 192.168.3.100.14874: [udp sum ok] UDP, length 1088
22:00:00.111238 IP (tos 0x0, ttl 64, id 26469, offset 0, flags [DF], proto TCP (6), length 1108)
    192.168.3.100.41373 > host109-145-119-56.range109-145.btcentralplus.com.33610: Flags [P.], cksum 0xad1c (incorrect -> 0xa850), seq 4993:6049, ack 1104, win 134, options [nop,nop,TS val 26203730 ecr 802200318], length 1056
22:00:00.160206 IP (tos 0x0, ttl 54, id 0, offset 0, flags [DF], proto TCP (6), length 52)
    host109-145-119-56.range109-145.btcentralplus.com.33610 > 192.168.3.100.41373: Flags [.], cksum 0xbc2d (correct), seq 1104, ack 6049, win 4063, options [nop,nop,TS val 802200548 ecr 26203730], length 0
22:00:00.203050 IP6 (hlim 255, next-header ICMPv6 (58) payload length: 32) fe80::1 > ff02::1: [icmp6 sum ok] ICMP6, neighbor advertisement, length 32, tgt is fe80::1, Flags [router, override]
	  destination link-address option (2), length 8 (1): d4:21:22:1e:23:80
	    0x0000:  d421 221e 2380
22:00:00.438797 IP (tos 0x0, ttl 54, id 15665, offset 0, flags [DF], proto UDP (17), length 1116)
    ip-176-195-174-253.bb.netbynet.ru.23654 > 192.168.3.100.14874: [udp sum ok] UDP, length 1088
22:00:00.439437 IP (tos 0x0, ttl 64, id 26470, offset 0, flags [DF], proto TCP (6), length 1108)
    192.168.3.100.41373 > host109-145-119-56.range109-145.btcentralplus.com.33610: Flags [P.], cksum 0xad1c (incorrect -> 0x0e65), seq 6049:7105, ack 1104, win 134, options [nop,nop,TS val 26203812 ecr 802200548], length 1056
22:00:00.443497 IP (tos 0x0, ttl 54, id 14079, offset 0, flags [DF], proto UDP (17), length 1116)
    pool-209-157-pppoe.icn.od.ua.27140 > 192.168.3.100.14874: [udp sum ok] UDP, length 1088
22:00:00.444495 IP (tos 0x0, ttl 54, id 14080, offset 0, flags [DF], proto UDP (17), length 1116)
    pool-209-157-pppoe.icn.od.ua.27140 > 192.168.3.100.14874: [udp sum ok] UDP, length 1088
22:00:00.452658 IP (tos 0x0, ttl 64, id 0, offset 0, flags [DF], proto UDP (17), length 99)
    192.168.3.100.3333 > 255.255.255.255.3333: [bad udp cksum 0xc46c -> 0x6ae8!] UDP, length 71
22:00:00.461521 IP (tos 0x0, ttl 54, id 15666, offset 0, flags [DF], proto UDP (17), length 1116)
    ip-176-195-174-253.bb.netbynet.ru.23654 > 192.168.3.100.14874: [udp sum ok] UDP, length 1088
22:00:00.483960 IP (tos 0x0, ttl 54, id 0, offset 0, flags [DF], proto TCP (6), length 52)
    host109-145-119-56.range109-145.btcentralplus.com.33610 > 192.168.3.100.41373: Flags [.], cksum 0xb696 (correct), seq 1104, ack 7105, win 4063, options [nop,nop,TS val 802200841 ecr 26203812], length 0
22:00:00.483995 IP (tos 0x0, ttl 64, id 26471, offset 0, flags [DF], proto TCP (6), length 1108)
    192.168.3.100.41373 > host109-145-119-56.range109-145.btcentralplus.com.33610: Flags [P.], cksum 0xad1c (incorrect -> 0x1d78), seq 7105:8161, ack 1104, win 134, options [nop,nop,TS val 26203823 ecr 802200841], length 1056
22:00:00.521301 IP (tos 0x0, ttl 64, id 20240, offset 0, flags [DF], proto TCP (6), length 1108)
    192.168.3.100.46438 > singapore.test.11372: Flags [P.], cksum 0xd1a0 (incorrect -> 0x2e59), seq 2112:3168, ack 1, win 134, options [nop,nop,TS val 26203832 ecr 422002807], length 1056
22:00:00.528466 IP (tos 0x0, ttl 54, id 0, offset 0, flags [DF], proto TCP (6), length 52)
    host109-145-119-56.range109-145.btcentralplus.com.33610 > 192.168.3.100.41373: Flags [.], cksum 0xb248 (correct), seq 1104, ack 8161, win 4063, options [nop,nop,TS val 802200876 ecr 26203823], length 0
22:00:00.726053 IP (tos 0x0, ttl 54, id 15678, offset 0, flags [DF], proto UDP (17), length 1116)
    ip-176-195-174-253.bb.netbynet.ru.23654 > 192.168.3.100.14874: [udp sum ok] UDP, length 1088
22:00:00.726643 IP (tos 0x0, ttl 64, id 26472, offset 0, flags [DF], proto TCP (6), length 1108)
    192.168.3.100.41373 > host109-145-119-56.range109-145.btcentralplus.com.33610: Flags [P.], cksum 0xad1c (incorrect -> 0x6252), seq 8161:9217, ack 1104, win 134, options [nop,nop,TS val 26203884 ecr 802200876], length 1056
22:00:00.740850 IP (tos 0x0, ttl 64, id 0, offset 0, flags [DF], proto UDP (17), length 134)
    192.168.3.100.14874 > pool-209-157-pppoe.icn.od.ua.27140: [bad udp cksum 0xc452 -> 0xb91f!] UDP, length 106
22:00:00.740877 IP (tos 0x0, ttl 64, id 0, offset 0, flags [DF], proto UDP (17), length 121)
    192.168.3.100.14874 > ip-176-195-174-253.bb.netbynet.ru.23654: [bad udp cksum 0x2444 -> 0xae01!] UDP, length 93
22:00:00.771227 IP (tos 0x0, ttl 54, id 0, offset 0, flags [DF], proto TCP (6), length 52)
    host109-145-119-56.range109-145.btcentralplus.com.33610 > 192.168.3.100.41373: Flags [.], cksum 0xad20 (correct), seq 1104, ack 9217, win 4063, options [nop,nop,TS val 802201079 ecr 26203884], length 0
22:00:00.803692 IP (tos 0x0, ttl 56, id 14656, offset 0, flags [DF], proto TCP (6), length 52)
    singapore.test.11372 > 192.168.3.100.46438: Flags [.], cksum 0x77af (correct), seq 1, ack 3168, win 2903, options [nop,nop,TS val 422003280 ecr 26203832], length 0
22:00:00.998749 IP (tos 0x0, ttl 47, id 0, offset 0, flags [DF], proto TCP (6), length 238)
    nat6-minsk-pool-46-53-211-208.telecom.by.59713 > 192.168.3.100.15441: Flags [P.], cksum 0xadac (correct), seq 747138088:747138274, ack 246406457, win 4096, options [nop,nop,TS val 137684799 ecr 26202466], length 186
22:00:00.999795 IP (tos 0x0, ttl 64, id 58862, offset 0, flags [DF], proto TCP (6), length 206)
    192.168.3.100.15441 > nat6-minsk-pool-46-53-211-208.telecom.by.59713: Flags [P.], cksum 0xc6d2 (incorrect -> 0xe9de), seq 1:155, ack 186, win 330, options [nop,nop,TS val 26203952 ecr 137684799], length 154
22:00:01.024755 IP (tos 0x0, ttl 64, id 50024, offset 0, flags [DF], proto TCP (6), length 60)
    192.168.3.100.54585 > 216.189.144.82.15441: Flags [S], cksum 0x2d4b (incorrect -> 0xca13), seq 421074014, win 14600, options [mss 1460,sackOK,TS val 26203958 ecr 0,nop,wscale 7], length 0
22:00:01.025188 IP (tos 0x0, ttl 64, id 57819, offset 0, flags [none], proto UDP (17), length 84)
    192.168.3.100.33333 > 46.47.254.2.domain: [bad udp cksum 0xf08f -> 0x5fdc!] 58314+ [1au] PTR? 82.144.189.216.in-addr.arpa. ar: . OPT UDPsize=4096 DO (56)
22:00:01.037780 IP (tos 0x0, ttl 64, id 0, offset 0, flags [DF], proto UDP (17), length 1126)
    192.168.3.100.14874 > cable-212.76.234.207.coditel.net.33270: [bad udp cksum 0x878c -> 0x3b21!] UDP, length 1098
22:00:01.089994 IP (tos 0x0, ttl 47, id 0, offset 0, flags [DF], proto TCP (6), length 52)
    nat6-minsk-pool-46-53-211-208.telecom.by.59713 > 192.168.3.100.15441: Flags [.], cksum 0x2ca1 (correct), seq 186, ack 155, win 4091, options [nop,nop,TS val 137684890 ecr 26203952], length 0
22:00:01.113136 IP (tos 0x0, ttl 64, id 0, offset 0, flags [DF], proto UDP (17), length 1128)
    192.168.3.100.14874 > cable-212.76.234.207.coditel.net.33270: [bad udp cksum 0x878e -> 0x844c!] UDP, length 1100
22:00:01.147986 IP (tos 0x0, ttl 55, id 0, offset 0, flags [DF], proto TCP (6), length 60)
    216.189.144.82.15441 > 192.168.3.100.54585: Flags [S.], cksum 0xdc7f (correct), seq 4182171411, ack 421074015, win 14480, options [mss 1452,sackOK,TS val 2667935394 ecr 26203958,nop,wscale 7], length 0
22:00:01.148031 IP (tos 0x0, ttl 64, id 50025, offset 0, flags [DF], proto TCP (6), length 52)
    192.168.3.100.54585 > 216.189.144.82.15441: Flags [.], cksum 0x2d43 (incorrect -> 0x4342), seq 1, ack 1, win 115, options [nop,nop,TS val 26203989 ecr 2667935394], length 0
22:00:01.503864 IP (tos 0x0, ttl 64, id 57820, offset 0, flags [none], proto UDP (17), length 84)
    192.168.3.100.33333 > 46.47.254.2.domain: [bad udp cksum 0xf08f -> 0x675c!] 16879+ [1au] PTR? 207.234.76.212.in-addr.arpa. ar: . OPT UDPsize=4096 DO (56)
22:00:01.524526 IP (tos 0x0, ttl 54, id 15714, offset 0, flags [DF], proto UDP (17), length 1116)
    ip-176-195-174-253.bb.netbynet.ru.23654 > 192.168.3.100.14874: [udp sum ok] UDP, length 1088
22:00:03.453873 IP (tos 0x0, ttl 64, id 0, offset 0, flags [DF], proto UDP (17), length 99)
    192.168.3.100.3333 > 255.255.255.255.3333: [bad udp cksum 0xc46c -> 0x6ae8!] UDP, length 71
22:00:03.495631 IP (tos 0x0, ttl 54, id 15842, offset 0, flags [DF], proto UDP (17), length 1116)
    ip-176-195-174-253.bb.netbynet.ru.23654 > 192.168.3.100.14874: [udp sum ok] UDP, length 1088
22:00:03.496229 IP (tos 0x0, ttl 64, id 26479, offset 0, flags [DF], proto TCP (6), length 1108)
    192.168.3.100.41373 > host109-145-119-56.range109-145.btcentralplus.com.33610: Flags [P.], cksum 0xad1c (incorrect -> 0x073d), seq 15553:16609, ack 1104, win 134, options [nop,nop,TS val 26204576 ecr 802202886], length 1056
22:00:03.511904 IP (tos 0x0, ttl 64, id 20241, offset 0, flags [DF], proto TCP (6), length 1108)
    192.168.3.100.46438 > singapore.test.11372: Flags [P.], cksum 0xd1a0 (incorrect -> 0x2d2d), seq 3168:4224, ack 1, win 134, options [nop,nop,TS val 26204580 ecr 422003280], length 1056
22:00:03.541587 IP (tos 0x0, ttl 54, id 0, offset 0, flags [DF], proto TCP (6), length 52)
    host109-145-119-56.range109-145.btcentralplus.com.33610 > 192.168.3.100.41373: Flags [.], cksum 0x846b (correct), seq 1104, ack 16609, win 4063, options [nop,nop,TS val 802203416 ecr 26204576], length 0
22:00:03.670763 IP (tos 0x0, ttl 64, id 55756, offset 0, flags [DF], proto UDP (17), length 44)
    192.168.3.100.54839 > tracker.coppersurfer.tk.6969: [bad udp cksum 0x035e -> 0x4899!] UDP, length 16
22:00:03.671319 IP (tos 0x0, ttl 64, id 57821, offset 0, flags [none], proto UDP (17), length 82)
    192.168.3.100.33333 > 46.47.254.2.domain: [bad udp cksum 0xf08d -> 0xba4f!] 20738+ [1au] PTR? 158.0.138.62.in-addr.arpa. ar: . OPT UDPsize=4096 DO (54)
22:00:03.700177 IP (tos 0x0, ttl 58, id 94, offset 0, flags [DF], proto UDP (17), length 44)
    tracker.coppersurfer.tk.6969 > 192.168.3.100.54839: [udp sum ok] UDP, length 16
22:00:03.701251 IP (tos 0x0, ttl 64, id 55763, offset 0, flags [DF], proto UDP (17), length 126)
    192.168.3.100.54839 > tracker.coppersurfer.tk.6969: [bad udp cksum 0x03b0 -> 0x4f70!] UDP, length 98
22:00:03.730600 IP (tos 0x0, ttl 58, id 101, offset 0, flags [DF], proto UDP (17), length 102)
    tracker.coppersurfer.tk.6969 > 192.168.3.100.54839: [udp sum ok] UDP, length 74
22:00:03.741550 IP (tos 0x0, ttl 55, id 0, offset 0, flags [DF], proto UDP (17), length 119)
    46.47.254.2.domain > 192.168.3.100.33333: [udp sum ok] 20738 q: PTR? 158.0.138.62.in-addr.arpa. 1/0/1 158.0.138.62.in-addr.arpa. PTR tracker.coppersurfer.tk. ar: . OPT UDPsize=1280 DO (91)
22:00:03.792845 IP (tos 0x0, ttl 56, id 14657, offset 0, flags [DF], proto TCP (6), length 52)
    singapore.test.11372 > 192.168.3.100.46438: Flags [.], cksum 0x6db8 (correct), seq 1, ack 4224, win 2903, options [nop,nop,TS val 422004027 ecr 26204580], length 0
22:00:04.112788 IP (tos 0x0, ttl 64, id 0, offset 0, flags [DF], proto UDP (17), length 125)
    192.168.3.100.14874 > ip-176-195-174-253.bb.netbynet.ru.23654: [bad udp cksum 0x2448 -> 0x39e7!] UDP, length 97
22:00:04.211422 IP (tos 0x0, ttl 54, id 15898, offset 0, flags [DF], proto UDP (17), length 1116)
    ip-176-195-174-253.bb.netbynet.ru.23654 > 192.168.3.100.14874: [udp sum ok] UDP, length 1088
22:00:04.212005 IP (tos 0x0, ttl 64, id 26480, offset 0, flags [DF], proto TCP (6), length 1108)
    192.168.3.100.41373 > host109-145-119-56.range109-145.btcentralplus.com.33610: Flags [P.], cksum 0xad1c (incorrect -> 0xc3ce), seq 16609:17665, ack 1104, win 134, options [nop,nop,TS val 26204755 ecr 802203416], length 1056
22:00:04.257652 IP (tos 0x0, ttl 54, id 0, offset 0, flags [DF], proto TCP (6), length 52)
    host109-145-119-56.range109-145.btcentralplus.com.33610 > 192.168.3.100.41373: Flags [.], cksum 0x7d3e (correct), seq 1104, ack 17665, win 4063, options [nop,nop,TS val 802204018 ecr 26204755], length 0
22:00:04.444402 IP (tos 0x0, ttl 53, id 34197, offset 0, flags [DF], proto TCP (6), length 595)
    82.ip-51-254-120.eu.https > 192.168.3.100.39735: Flags [P.], cksum 0x9831 (correct), seq 2524312500:2524313043, ack 219182148, win 3855, options [nop,nop,TS val 132927905 ecr 26204004], length 543
22:00:04.444439 IP (tos 0x0, ttl 64, id 26970, offset 0, flags [DF], proto TCP (6), length 52)
    192.168.3.100.39735 > 82.ip-51-254-120.eu.https: Flags [.], cksum 0x7083 (incorrect -> 0x2425), seq 1, ack 543, win 513, options [nop,nop,TS val 26204813 ecr 132927905], length 0
22:00:04.454344 IP (tos 0x0, ttl 64, id 0, offset 0, flags [DF], proto UDP (17), length 99)
    192.168.3.100.3333 > 255.255.255.255.3333: [bad udp cksum 0xc46c -> 0x6ae8!] UDP, length 71
22:00:04.456165 IP (tos 0x0, ttl 54, id 15911, offset 0, flags [DF], proto UDP (17), length 1116)
    ip-176-195-174-253.bb.netbynet.ru.23654 > 192.168.3.100.14874: [udp sum ok] UDP, length 1088
22:00:04.456735 IP (tos 0x0, ttl 64, id 26481, offset 0, flags [DF], proto TCP (6), length 1108)
    192.168.3.100.41373 > host109-145-119-56.range109-145.btcentralplus.com.33610: Flags [P.], cksum 0xad1c (incorrect -> 0xc8b0), seq 17665:18721, ack 1104, win 134, options [nop,nop,TS val 26204816 ecr 802204018], length 1056
22:00:04.501364 IP (tos 0x0, ttl 54, id 0, offset 0, flags [DF], proto TCP (6), length 52)
    host109-145-119-56.range109-145.btcentralplus.com.33610 > 192.168.3.100.41373: Flags [.], cksum 0x7805 (correct), seq 1104, ack 18721, win 4063, options [nop,nop,TS val 802204238 ecr 26204816], length 0
22:00:04.544915 IP (tos 0x0, ttl 54, id 15915, offset 0, flags [DF], proto UDP (17), length 1116)
    ip-176-195-174-253.bb.netbynet.ru.23654 > 192.168.3.100.14874: [udp sum ok] UDP, length 1088
22:00:04.545119 IP (tos 0x0, ttl 54, id 15916, offset 0, flags [DF], proto UDP (17), length 1116)
    ip-176-195-174-253.bb.netbynet.ru.23654 > 192.168.3.100.14874: [udp sum ok] UDP, length 1088
22:00:04.545549 IP (tos 0x0, ttl 64, id 26482, offset 0, flags [DF], proto TCP (6), length 1108)
    192.168.3.100.41373 > host109-145-119-56.range109-145.btcentralplus.com.33610: Flags [P.], cksum 0xad1c (incorrect -> 0xc0e1), seq 18721:19777, ack 1104, win 134, options [nop,nop,TS val 26204838 ecr 802204238], length 1056
22:00:04.589436 IP (tos 0x0, ttl 54, id 15921, offset 0, flags [DF], proto UDP (17), length 1116)
    ip-176-195-174-253.bb.netbynet.ru.23654 > 192.168.3.100.14874: [udp sum ok] UDP, length 1088
22:00:04.589855 IP (tos 0x0, ttl 54, id 0, offset 0, flags [DF], proto TCP (6), length 52)
    host109-145-119-56.range109-145.btcentralplus.com.33610 > 192.168.3.100.41373: Flags [.], cksum 0x739d (correct), seq 1104, ack 19777, win 4030, options [nop,nop,TS val 802204321 ecr 26204838], length 0
22:00:04.589883 IP (tos 0x0, ttl 64, id 26483, offset 0, flags [DF], proto TCP (6), length 1108)
    192.168.3.100.41373 > host109-145-119-56.range109-145.btcentralplus.com.33610: Flags [P.], cksum 0xad1c (incorrect -> 0x7356), seq 19777:20833, ack 1104, win 134, options [nop,nop,TS val 26204849 ecr 802204321], length 1056
22:00:04.633882 IP (tos 0x0, ttl 54, id 0, offset 0, flags [DF], proto TCP (6), length 52)
    host109-145-119-56.range109-145.btcentralplus.com.33610 > 192.168.3.100.41373: Flags [.], cksum 0x6f68 (correct), seq 1104, ack 20833, win 3997, options [nop,nop,TS val 802204364 ecr 26204849], length 0
22:00:04.633948 IP (tos 0x0, ttl 64, id 26484, offset 0, flags [DF], proto TCP (6), length 1108)
    192.168.3.100.41373 > host109-145-119-56.range109-145.btcentralplus.com.33610: Flags [P.], cksum 0xad1c (incorrect -> 0x9f2e), seq 20833:21889, ack 1104, win 134, options [nop,nop,TS val 26204861 ecr 802204364], length 1056
22:00:04.646917 IP (tos 0x0, ttl 54, id 15924, offset 0, flags [DF], proto UDP (17), length 1116)
    ip-176-195-174-253.bb.netbynet.ru.23654 > 192.168.3.100.14874: [udp sum ok] UDP, length 1088
22:00:04.647337 IP (tos 0x0, ttl 54, id 0, offset 0, flags [DF], proto TCP (6), length 52)
    host109-145-119-56.range109-145.btcentralplus.com.33610 > 192.168.3.100.41373: Flags [.], cksum 0x6ef9 (correct), seq 1104, ack 20833, win 4096, options [nop,nop,TS val 802204376 ecr 26204849], length 0
22:00:04.678879 IP (tos 0x0, ttl 54, id 0, offset 0, flags [DF], proto TCP (6), length 52)
    host109-145-119-56.range109-145.btcentralplus.com.33610 > 192.168.3.100.41373: Flags [.], cksum 0x6ad2 (correct), seq 1104, ack 21889, win 4063, options [nop,nop,TS val 802204404 ecr 26204861], length 0
22:00:04.678920 IP (tos 0x0, ttl 64, id 26485, offset 0, flags [DF], proto TCP (6), length 1108)
    192.168.3.100.41373 > host109-145-119-56.range109-145.btcentralplus.com.33610: Flags [P.], cksum 0xad1c (incorrect -> 0xcea9), seq 21889:22945, ack 1104, win 134, options [nop,nop,TS val 26204872 ecr 802204404], length 1056
22:00:04.723875 IP (tos 0x0, ttl 54, id 0, offset 0, flags [DF], proto TCP (6), length 52)
    host109-145-119-56.range109-145.btcentralplus.com.33610 > 192.168.3.100.41373: Flags [.], cksum 0x6683 (correct), seq 1104, ack 22945, win 4063, options [nop,nop,TS val 802204440 ecr 26204872], length 0
22:00:04.734462 IP (tos 0x0, ttl 64, id 23455, offset 0, flags [DF], proto TCP (6), length 595)
    192.168.3.100.50430 > 82.ip-51-254-120.eu.https: Flags [P.], cksum 0x72a2 (incorrect -> 0x5be7), seq 8370:8913, ack 2172, win 331, options [nop,nop,TS val 26204886 ecr 132927443], length 543
22:00:04.763880 IP (tos 0x0, ttl 53, id 42986, offset 0, flags [DF], proto TCP (6), length 52)
    82.ip-51-254-120.eu.https > 192.168.3.100.50430: Flags [.], cksum 0x10b1 (correct), seq 2172, ack 8913, win 1804, options [nop,nop,TS val 132927985 ecr 26204886], length 0
22:00:04.828557 IP (tos 0x0, ttl 64, id 0, offset 0, flags [DF], proto UDP (17), length 142)
    192.168.3.100.14874 > ip-176-195-174-253.bb.netbynet.ru.23654: [bad udp cksum 0x2459 -> 0x8aa1!] UDP, length 114
22:00:04.997948 IP6 (hlim 255, next-header TCP (6) payload length: 32) p200300E853D8E07A1E7508FFFEA2DFF0.dip0.t-ipconnect.de.38526 > 2a00:1e48:1:41::bc2b:4c51.http: Flags [.], cksum 0xac73 (incorrect -> 0xe9f0), seq 2787518049, ack 3238861955, win 127, options [nop,nop,TS val 26204952 ecr 1027507507], length 0
22:00:05.048450 IP (tos 0x0, ttl 54, id 15939, offset 0, flags [DF], proto UDP (17), length 1116)
    ip-176-195-174-253.bb.netbynet.ru.23654 > 192.168.3.100.14874: [udp sum ok] UDP, length 1088
22:00:05.049021 IP (tos 0x0, ttl 64, id 26486, offset 0, flags [DF], proto TCP (6), length 1108)
    192.168.3.100.41373 > host109-145-119-56.range109-145.btcentralplus.com.33610: Flags [P.], cksum 0xad1c (incorrect -> 0xdcbc), seq 22945:24001, ack 1104, win 134, options [nop,nop,TS val 26204964 ecr 802204440], length 1056
22:00:05.065143 IP6 (flowlabel 0x5f13c, hlim 58, next-header TCP (6) payload length: 32) 2a00:1e48:1:41::bc2b:4c51.http > p200300E853D8E07A1E7508FFFEA2DFF0.dip0.t-ipconnect.de.38526: Flags [.], cksum 0x21ce (correct), seq 1, ack 1, win 926, options [nop,nop,TS val 1027517587 ecr 26179771], length 0
22:00:05.094939 IP (tos 0x0, ttl 54, id 0, offset 0, flags [DF], proto TCP (6), length 52)
    host109-145-119-56.range109-145.btcentralplus.com.33610 > 192.168.3.100.41373: Flags [.], cksum 0x60ce (correct), seq 1104, ack 24001, win 4063, options [nop,nop,TS val 802204753 ecr 26204964], length 0
22:00:05.267678 IP (tos 0x0, ttl 53, id 42987, offset 0, flags [DF], proto TCP (6), length 595)
    82.ip-51-254-120.eu.https > 192.168.3.100.50430: Flags [P.], cksum 0xc8eb (correct), seq 2172:2715, ack 8913, win 1804, options [nop,nop,TS val 132928111 ecr 26204886], length 543
22:00:05.267721 IP (tos 0x0, ttl 64, id 23456, offset 0, flags [DF], proto TCP (6), length 52)
    192.168.3.100.50430 > 82.ip-51-254-120.eu.https: Flags [.], cksum 0x7083 (incorrect -> 0x1350), seq 8913, ack 2715, win 331, options [nop,nop,TS val 26205019 ecr 132928111], length 0
22:00:05.268639 IP (tos 0x0, ttl 64, id 23457, offset 0, flags [DF], proto TCP (6), length 595)
    192.168.3.100.50430 > 82.ip-51-254-120.eu.https: Flags [P.], cksum 0x72a2 (incorrect -> 0xb703), seq 8913:9456, ack 2715, win 331, options [nop,nop,TS val 26205019 ecr 132928111], length 543
22:00:05.297164 IP (tos 0x0, ttl 53, id 42988, offset 0, flags [DF], proto TCP (6), length 52)
    82.ip-51-254-120.eu.https > 192.168.3.100.50430: Flags [.], cksum 0x0b69 (correct), seq 2715, ack 9456, win 1804, options [nop,nop,TS val 132928118 ecr 26205019], length 0
22:00:05.407700 IP (tos 0x0, ttl 54, id 15965, offset 0, flags [DF], proto UDP (17), length 1116)
    ip-176-195-174-253.bb.netbynet.ru.23654 > 192.168.3.100.14874: [udp sum ok] UDP, length 1088
22:00:05.408318 IP (tos 0x0, ttl 64, id 26487, offset 0, flags [DF], proto TCP (6), length 1108)
    192.168.3.100.41373 > host109-145-119-56.range109-145.btcentralplus.com.33610: Flags [P.], cksum 0xad1c (incorrect -> 0x3b5b), seq 24001:25057, ack 1104, win 134, options [nop,nop,TS val 26205054 ecr 802204753], length 1056
22:00:05.453166 IP (tos 0x0, ttl 54, id 0, offset 0, flags [DF], proto TCP (6), length 52)
    host109-145-119-56.range109-145.btcentralplus.com.33610 > 192.168.3.100.41373: Flags [.], cksum 0x5b18 (correct), seq 1104, ack 25057, win 4063, options [nop,nop,TS val 802205069 ecr 26205054], length 0
22:00:05.454730 IP (tos 0x0, ttl 64, id 0, offset 0, flags [DF], proto UDP (17), length 99)
    192.168.3.100.3333 > 255.255.255.255.3333: [bad udp cksum 0xc46c -> 0x6ae8!] UDP, length 71
22:00:05.564391 IP (tos 0x0, ttl 64, id 0, offset 0, flags [DF], proto UDP (17), length 82)
    192.168.3.100.14874 > fp276e8584.stmb106.ap.nuro.jp.30238: [bad udp cksum 0x714e -> 0xa54b!] UDP, length 54
22:00:05.565008 IP (tos 0x0, ttl 64, id 57822, offset 0, flags [none], proto UDP (17), length 84)
    192.168.3.100.33333 > 46.47.254.2.domain: [bad udp cksum 0xf08f -> 0x73ae!] 24444+ [1au] PTR? 132.133.110.39.in-addr.arpa. ar: . OPT UDPsize=4096 DO (56)
22:00:05.643964 IP (tos 0x0, ttl 54, id 15988, offset 0, flags [DF], proto UDP (17), length 1116)
    ip-176-195-174-253.bb.netbynet.ru.23654 > 192.168.3.100.14874: [udp sum ok] UDP, length 1088
22:00:05.644521 IP (tos 0x0, ttl 64, id 26488, offset 0, flags [DF], proto TCP (6), length 1108)
    192.168.3.100.41373 > host109-145-119-56.range109-145.btcentralplus.com.33610: Flags [P.], cksum 0xad1c (incorrect -> 0x4b2c), seq 25057:26113, ack 1104, win 134, options [nop,nop,TS val 26205113 ecr 802205069], length 1056
22:00:05.665480 IP (tos 0x0, ttl 64, id 0, offset 0, flags [DF], proto UDP (17), length 152)
    192.168.3.100.14874 > ip-176-195-174-253.bb.netbynet.ru.23654: [bad udp cksum 0x2463 -> 0x8b24!] UDP, length 124
22:00:05.688947 IP (tos 0x0, ttl 54, id 0, offset 0, flags [DF], proto TCP (6), length 52)
    host109-145-119-56.range109-145.btcentralplus.com.33610 > 192.168.3.100.41373: Flags [.], cksum 0x55f7 (correct), seq 1104, ack 26113, win 4063, options [nop,nop,TS val 802205267 ecr 26205113], length 0
22:00:05.859453 IP (tos 0x0, ttl 53, id 42989, offset 0, flags [DF], proto TCP (6), length 595)
    82.ip-51-254-120.eu.https > 192.168.3.100.50430: Flags [P.], cksum 0x5889 (correct), seq 2715:3258, ack 9456, win 1804, options [nop,nop,TS val 132928259 ecr 26205019], length 543
22:00:06.938772 IP (tos 0x0, ttl 54, id 16063, offset 0, flags [DF], proto UDP (17), length 1116)
    ip-176-195-174-253.bb.netbynet.ru.23654 > 192.168.3.100.14874: [udp sum ok] UDP, length 1088
22:00:06.939390 IP (tos 0x0, ttl 64, id 26493, offset 0, flags [DF], proto TCP (6), length 1108)
    192.168.3.100.41373 > host109-145-119-56.range109-145.btcentralplus.com.33610: Flags [P.], cksum 0xad1c (incorrect -> 0xe233), seq 30337:31393, ack 1104, win 134, options [nop,nop,TS val 26205437 ecr 802205900], length 1056
22:00:06.983467 IP (tos 0x0, ttl 54, id 0, offset 0, flags [DF], proto TCP (6), length 52)
    host109-145-119-56.range109-145.btcentralplus.com.33610 > 192.168.3.100.41373: Flags [.], cksum 0x3bb3 (correct), seq 1104, ack 31393, win 4063, options [nop,nop,TS val 802206387 ecr 26205437], length 0
22:00:07.455219 IP (tos 0x0, ttl 64, id 0, offset 0, flags [DF], proto UDP (17), length 99)
    192.168.3.100.3333 > 255.255.255.255.3333: [bad udp cksum 0xc46c -> 0x6ae8!] UDP, length 71
22:00:07.492291 IP (tos 0x0, ttl 54, id 16096, offset 0, flags [DF], proto UDP (17), length 1116)
    ip-176-195-174-253.bb.netbynet.ru.23654 > 192.168.3.100.14874: [udp sum ok] UDP, length 1088
22:00:07.492900 IP (tos 0x0, ttl 64, id 26494, offset 0, flags [DF], proto TCP (6), length 1108)
    192.168.3.100.41373 > host109-145-119-56.range109-145.btcentralplus.com.33610: Flags [P.], cksum 0xad1c (incorrect -> 0x2c63), seq 31393:32449, ack 1104, win 134, options [nop,nop,TS val 26205575 ecr 802206387], length 1056
22:00:07.515271 IP (tos 0x0, ttl 64, id 21780, offset 0, flags [DF], proto TCP (6), length 60)
    192.168.3.100.33065 > 210-244-71-25.adsl.dynamic.seed.net.tw.6969: Flags [S], cksum 0xde48 (incorrect -> 0xe5e4), seq 1189120153, win 14600, options [mss 1460,sackOK,TS val 26205581 ecr 0,nop,wscale 7], length 0
22:00:07.540740 IP (tos 0x0, ttl 54, id 0, offset 0, flags [DF], proto TCP (6), length 52)
    host109-145-119-56.range109-145.btcentralplus.com.33610 > 192.168.3.100.41373: Flags [.], cksum 0x3535 (correct), seq 1104, ack 32449, win 4063, options [nop,nop,TS val 802206855 ecr 26205575], length 0
22:00:07.555873 IP (tos 0x0, ttl 64, id 0, offset 0, flags [DF], proto UDP (17), length 132)
    192.168.3.100.14874 > ip-176-195-174-253.bb.netbynet.ru.23654: [bad udp cksum 0x244f -> 0xf92b!] UDP, length 104
22:00:07.789784 IP (tos 0x0, ttl 53, id 34198, offset 0, flags [DF], proto TCP (6), length 595)
    82.ip-51-254-120.eu.https > 192.168.3.100.39735: Flags [P.], cksum 0x4466 (correct), seq 543:1086, ack 1, win 3855, options [nop,nop,TS val 132928741 ecr 26204813], length 543
22:00:07.789821 IP (tos 0x0, ttl 64, id 26971, offset 0, flags [DF], proto TCP (6), length 52)
    192.168.3.100.39735 > 82.ip-51-254-120.eu.https: Flags [.], cksum 0x7083 (incorrect -> 0x1b7e), seq 1, ack 1086, win 513, options [nop,nop,TS val 26205649 ecr 132928741], length 0
22:00:07.943603 IP (tos 0x0, ttl 54, id 16116, offset 0, flags [DF], proto UDP (17), length 1116)
    ip-176-195-174-253.bb.netbynet.ru.23654 > 192.168.3.100.14874: [udp sum ok] UDP, length 1088
22:00:07.944200 IP (tos 0x0, ttl 64, id 26495, offset 0, flags [DF], proto TCP (6), length 1108)
    192.168.3.100.41373 > host109-145-119-56.range109-145.btcentralplus.com.33610: Flags [P.], cksum 0xad1c (incorrect -> 0x1aa4), seq 32449:33505, ack 1104, win 134, options [nop,nop,TS val 26205688 ecr 802206855], length 1056
22:00:07.991758 IP (tos 0x0, ttl 54, id 0, offset 0, flags [DF], proto TCP (6), length 52)
    host109-145-119-56.range109-145.btcentralplus.com.33610 > 192.168.3.100.41373: Flags [.], cksum 0x2f28 (correct), seq 1104, ack 33505, win 4063, options [nop,nop,TS val 802207235 ecr 26205688], length 0
22:00:08.212547 IP6 (hlim 255, next-header ICMPv6 (58) payload length: 32) fe80::1 > ff02::1: [icmp6 sum ok] ICMP6, neighbor advertisement, length 32, tgt is fe80::1, Flags [router, override]
	  destination link-address option (2), length 8 (1): d4:21:22:1e:23:80
	    0x0000:  d421 221e 2380
22:00:08.454320 IP (tos 0x0, ttl 54, id 16125, offset 0, flags [DF], proto UDP (17), length 1116)
    ip-176-195-174-253.bb.netbynet.ru.23654 > 192.168.3.100.14874: [udp sum ok] UDP, length 1088
22:00:08.454919 IP (tos 0x0, ttl 64, id 26496, offset 0, flags [DF], proto TCP (6), length 1108)
    192.168.3.100.41373 > host109-145-119-56.range109-145.btcentralplus.com.33610: Flags [P.], cksum 0xad1c (incorrect -> 0xa6b7), seq 33505:34561, ack 1104, win 134, options [nop,nop,TS val 26205816 ecr 802207235], length 1056
22:00:08.455328 IP (tos 0x0, ttl 64, id 0, offset 0, flags [DF], proto UDP (17), length 99)
    192.168.3.100.3333 > 255.255.255.255.3333: [bad udp cksum 0xc46c -> 0x6ae8!] UDP, length 71
22:00:08.501532 IP (tos 0x0, ttl 54, id 0, offset 0, flags [DF], proto TCP (6), length 52)
    host109-145-119-56.range109-145.btcentralplus.com.33610 > 192.168.3.100.41373: Flags [.], cksum 0x28e1 (correct), seq 1104, ack 34561, win 4063, options [nop,nop,TS val 802207658 ecr 26205816], length 0
22:00:08.513954 IP (tos 0x0, ttl 64, id 21781, offset 0, flags [DF], proto TCP (6), length 60)
    192.168.3.100.33065 > 210-244-71-25.adsl.dynamic.seed.net.tw.6969: Flags [S], cksum 0xde48 (incorrect -> 0xe4ea), seq 1189120153, win 14600, options [mss 1460,sackOK,TS val 26205831 ecr 0,nop,wscale 7], length 0
22:00:08.560756 IP (tos 0x0, ttl 64, id 0, offset 0, flags [DF], proto UDP (17), length 134)
    192.168.3.100.14874 > ip-176-195-174-253.bb.netbynet.ru.23654: [bad udp cksum 0x2451 -> 0xd3aa!] UDP, length 106
22:00:08.564591 IP (tos 0x0, ttl 64, id 0, offset 0, flags [DF], proto UDP (17), length 79)
    192.168.3.100.14874 > 212-55-94-23.dynamic-pool.mclaut.net.22967: [bad udp cksum 0xf6a7 -> 0xb478!] UDP, length 51
22:00:08.565206 IP (tos 0x0, ttl 64, id 24029, offset 0, flags [none], proto UDP (17), length 71)
    192.168.3.100.33333 > 46.172.120.58.domain: [bad udp cksum 0x6b37 -> 0xfe3f!] 48388+ PTR? 23.94.55.212.in-addr.arpa. (43)
22:00:09.003860 IP (tos 0x0, ttl 54, id 16180, offset 0, flags [DF], proto UDP (17), length 1116)
    ip-176-195-174-253.bb.netbynet.ru.23654 > 192.168.3.100.14874: [udp sum ok] UDP, length 1088
22:00:09.004401 IP (tos 0x0, ttl 64, id 26497, offset 0, flags [DF], proto TCP (6), length 1108)
    192.168.3.100.41373 > host109-145-119-56.range109-145.btcentralplus.com.33610: Flags [P.], cksum 0xad1c (incorrect -> 0x94f3), seq 34561:35617, ack 1104, win 134, options [nop,nop,TS val 26205953 ecr 802207658], length 1056
22:00:09.048808 IP (tos 0x0, ttl 54, id 0, offset 0, flags [DF], proto TCP (6), length 52)
    host109-145-119-56.range109-145.btcentralplus.com.33610 > 192.168.3.100.41373: Flags [.], cksum 0x2271 (correct), seq 1104, ack 35617, win 4063, options [nop,nop,TS val 802208113 ecr 26205953], length 0
22:00:09.052589 IP (tos 0x0, ttl 54, id 16184, offset 0, flags [DF], proto UDP (17), length 1116)
    ip-176-195-174-253.bb.netbynet.ru.23654 > 192.168.3.100.14874: [udp sum ok] UDP, length 1088
22:00:09.052802 IP (tos 0x0, ttl 54, id 16185, offset 0, flags [DF], proto UDP (17), length 1116)
    ip-176-195-174-253.bb.netbynet.ru.23654 > 192.168.3.100.14874: [udp sum ok] UDP, length 1088
22:00:09.427889 IP (tos 0x0, ttl 64, id 20242, offset 0, flags [DF], proto TCP (6), length 1108)
    192.168.3.100.46438 > singapore.test.11372: Flags [P.], cksum 0xd1a0 (incorrect -> 0x2de5), seq 4224:5280, ack 1, win 134, options [nop,nop,TS val 26206059 ecr 422004027], length 1056
22:00:09.455827 IP (tos 0x0, ttl 64, id 0, offset 0, flags [DF], proto UDP (17), length 99)
    192.168.3.100.3333 > 255.255.255.255.3333: [bad udp cksum 0xc46c -> 0x6ae8!] UDP, length 71
22:00:09.620886 IP (tos 0x0, ttl 64, id 0, offset 0, flags [DF], proto UDP (17), length 147)
    192.168.3.100.14874 > ip-176-195-174-253.bb.netbynet.ru.23654: [bad udp cksum 0x245e -> 0xfc9f!] UDP, length 119
22:00:09.708838 IP (tos 0x0, ttl 56, id 14658, offset 0, flags [DF], proto TCP (6), length 52)
    singapore.test.11372 > 192.168.3.100.46438: Flags [.], cksum 0x5e0a (correct), seq 1, ack 5280, win 2903, options [nop,nop,TS val 422005506 ecr 26206059], length 0
22:00:10.180584 IP (tos 0x0, ttl 117, id 9810, offset 0, flags [DF], proto TCP (6), length 983)
    balancer2.static.corbina.ru.50920 > 192.168.3.100.15441: Flags [P.], cksum 0x410c (correct), seq 3116933265:3116934208, ack 2166351815, win 1086, length 943
22:00:10.182334 IP (tos 0x0, ttl 64, id 57823, offset 0, flags [none], proto UDP (17), length 81)
    192.168.3.100.33333 > 46.47.254.2.domain: [bad udp cksum 0xf08c -> 0x29c9!] 20816+ [1au] PTR? 24.15.31.95.in-addr.arpa. ar: . OPT UDPsize=4096 DO (53)
22:00:10.186500 IP (tos 0x0, ttl 64, id 55151, offset 0, flags [DF], proto TCP (6), length 138)
    192.168.3.100.15441 > balancer2.static.corbina.ru.50920: Flags [P.], cksum 0x32c0 (incorrect -> 0x922b), seq 1:99, ack 943, win 3309, length 98
22:00:10.190639 IP (tos 0x0, ttl 64, id 55152, offset 0, flags [DF], proto TCP (6), length 216)
    192.168.3.100.15441 > balancer2.static.corbina.ru.50920: Flags [P.], cksum 0x330e (incorrect -> 0x0952), seq 99:275, ack 943, win 3309, length 176
22:00:10.258595 IP (tos 0x0, ttl 117, id 9811, offset 0, flags [DF], proto TCP (6), length 40)
    balancer2.static.corbina.ru.50920 > 192.168.3.100.15441: Flags [.], cksum 0xae17 (correct), seq 943, ack 275, win 1085, length 0
22:00:10.259142 IP (tos 0x0, ttl 117, id 9812, offset 0, flags [DF], proto TCP (6), length 129)
    balancer2.static.corbina.ru.50920 > 192.168.3.100.15441: Flags [P.], cksum 0xdd90 (correct), seq 943:1032, ack 275, win 1085, length 89
22:00:10.259888 IP (tos 0x0, ttl 117, id 9813, offset 0, flags [DF], proto TCP (6), length 1460)
    balancer2.static.corbina.ru.50920 > 192.168.3.100.15441: Flags [.], cksum 0xd0bf (correct), seq 1032:2452, ack 275, win 1085, length 1420
22:00:10.389639 IP (tos 0x0, ttl 51, id 3536, offset 0, flags [DF], proto TCP (6), length 995)
    39.155.134.98.65527 > 192.168.3.100.15441: Flags [P.], cksum 0xe504 (correct), seq 2006650173:2006651116, ack 3742992108, win 254, options [nop,nop,TS val 160953554 ecr 26199119], length 943
22:00:10.390220 IP (tos 0x0, ttl 64, id 57824, offset 0, flags [none], proto UDP (17), length 83)
    192.168.3.100.33333 > 46.47.254.2.domain: [bad udp cksum 0xf08e -> 0x9262!] 33699+ [1au] PTR? 98.134.155.39.in-addr.arpa. ar: . OPT UDPsize=4096 DO (55)
22:00:10.413361 IP (tos 0x0, ttl 55, id 4224, offset 0, flags [none], proto UDP (17), length 87)
    1-36-124-145.static.netvigator.com.1035 > 192.168.3.100.14874: [udp sum ok] UDP, length 59
22:00:10.425956 IP (tos 0x0, ttl 64, id 57270, offset 0, flags [DF], proto TCP (6), length 52)
    192.168.3.100.15441 > 39.155.134.98.65527: Flags [.], cksum 0x7230 (incorrect -> 0xf833), seq 1, ack 943, win 330, options [nop,nop,TS val 26206309 ecr 160953554], length 0
22:00:10.455818 IP (tos 0x0, ttl 64, id 0, offset 0, flags [DF], proto UDP (17), length 99)
    192.168.3.100.3333 > 255.255.255.255.3333: [bad udp cksum 0xc46c -> 0x6ae8!] UDP, length 71
22:00:10.484157 IP (tos 0x0, ttl 54, id 16186, offset 0, flags [DF], proto UDP (17), length 1116)
    ip-176-195-174-253.bb.netbynet.ru.23654 > 192.168.3.100.14874: [udp sum ok] UDP, length 1088
22:00:10.484727 IP (tos 0x0, ttl 64, id 26500, offset 0, flags [DF], proto TCP (6), length 1108)
    192.168.3.100.41373 > host109-145-119-56.range109-145.btcentralplus.com.33610: Flags [P.], cksum 0xad1c (incorrect -> 0xe36b), seq 37729:38785, ack 1104, win 134, options [nop,nop,TS val 26206323 ecr 802208191], length 1056
22:00:10.520739 IP (tos 0x0, ttl 64, id 57825, offset 0, flags [none], proto UDP (17), length 82)
    192.168.3.100.33333 > 46.47.254.2.domain: [bad udp cksum 0xf08d -> 0xa717!] 12915+ [1au] PTR? 145.124.36.1.in-addr.arpa. ar: . OPT UDPsize=4096 DO (54)
22:00:10.529342 IP (tos 0x0, ttl 54, id 0, offset 0, flags [DF], proto TCP (6), length 52)
    host109-145-119-56.range109-145.btcentralplus.com.33610 > 192.168.3.100.41373: Flags [.], cksum 0x0fc3 (correct), seq 1104, ack 38785, win 4063, options [nop,nop,TS val 802209357 ecr 26206323], length 0
22:00:11.331180 IP (tos 0x0, ttl 57, id 54261, offset 0, flags [DF], proto TCP (6), length 52)
    tor-exit1.signal.center.35290 > 192.168.3.100.15441: Flags [.], cksum 0x8ad0 (correct), seq 1478951747, ack 2401890959, win 3854, options [nop,nop,TS val 100516249 ecr 26206518], length 0
22:00:11.331748 IP (tos 0x0, ttl 64, id 57826, offset 0, flags [none], proto UDP (17), length 84)
    192.168.3.100.33333 > 46.47.254.2.domain: [bad udp cksum 0xf08f -> 0x9f6a!] 13229+ [1au] PTR? 176.115.118.87.in-addr.arpa. ar: . OPT UDPsize=4096 DO (56)
22:00:11.334877 IP (tos 0x0, ttl 57, id 54262, offset 0, flags [DF], proto TCP (6), length 52)
    tor-exit1.signal.center.35290 > 192.168.3.100.15441: Flags [.], cksum 0x7f8f (correct), seq 0, ack 2881, win 3854, options [nop,nop,TS val 100516250 ecr 26206518], length 0
22:00:11.335359 IP (tos 0x0, ttl 57, id 54263, offset 0, flags [DF], proto TCP (6), length 52)
    tor-exit1.signal.center.35290 > 192.168.3.100.15441: Flags [.], cksum 0x744d (correct), seq 0, ack 5761, win 3854, options [nop,nop,TS val 100516250 ecr 26206520], length 0
22:00:11.335844 IP (tos 0x0, ttl 117, id 10365, offset 0, flags [DF], proto TCP (6), length 40)
    180.124.132.50.59981 > 192.168.3.100.15441: Flags [.], cksum 0xc90f (correct), seq 1323623771, ack 2645419018, win 3442, length 0
22:00:11.336086 IP (tos 0x0, ttl 57, id 54264, offset 0, flags [DF], proto TCP (6), length 52)
    tor-exit1.signal.center.35290 > 192.168.3.100.15441: Flags [.], cksum 0x690d (correct), seq 0, ack 8641, win 3854, options [nop,nop,TS val 100516250 ecr 26206520], length 0
22:00:11.337601 IP (tos 0x0, ttl 57, id 54265, offset 0, flags [DF], proto TCP (6), length 52)
    tor-exit1.signal.center.35290 > 192.168.3.100.15441: Flags [.], cksum 0x5dcc (correct), seq 0, ack 11521, win 3854, options [nop,nop,TS val 100516251 ecr 26206520], length 0
22:00:11.604691 IP (tos 0x0, ttl 115, id 32338, offset 0, flags [DF], proto TCP (6), length 983)
    bas2-montrealak-70-49-71-91.dsl.bell.ca.16187 > 192.168.3.100.15441: Flags [P.], cksum 0x40af (correct), seq 816494786:816495729, ack 3864960152, win 257, length 943

